{
  "gold_version": "2.5",
  "case_id": "rudin_ch2_v25",
  "status": "human_review_required",
  "review": {
    "required": true,
    "completed": false,
    "minimum_reviewers": 2,
    "note": "Auto-generated candidate boundaries require independent include/exclude and atomic review."
  },
  "candidate_count": 387,
  "items": [
    {
      "block_id": "K-001",
      "decision": null,
      "kind": "other",
      "source_start_line": 1,
      "source_end_line": 1,
      "source_anchor": "## FINITE, COUNTABLE, AND UNCOUNTABLE SETS",
      "atomic_requirements": [],
      "weight": 1,
      "review": "required"
    },
    {
      "block_id": "K-003",
      "decision": null,
      "kind": "definition",
      "source_start_line": 3,
      "source_end_line": 3,
      "source_anchor": "We begin this section with a definition of the function concept.",
      "atomic_requirements": [],
      "weight": 1,
      "review": "required"
    },
    {
      "block_id": "K-005",
      "decision": null,
      "kind": "definition",
      "source_start_line": 5,
      "source_end_line": 5,
      "source_anchor": "2.1 Definition Consider two sets A and B, whose elements may be any objects whatsoever, and suppose that with each element x of A there is associated, in some manner, an element of B, which we denote ",
      "atomic_requirements": [],
      "weight": 1,
      "review": "required"
    },
    {
      "block_id": "K-007",
      "decision": null,
      "kind": "definition",
      "source_start_line": 7,
      "source_end_line": 7,
      "source_anchor": "2.2 Definition Let $A$ and $B$ be two sets and let $f$ be a mapping of $A$ into $B$ . If $E \\subset A, f(E)$ is defined to be the set of all elements $f(x)$ , for $x \\in E$ . We call $f(E)$ the image ",
      "atomic_requirements": [],
      "weight": 1,
      "review": "required"
    },
    {
      "block_id": "K-009",
      "decision": null,
      "kind": "formula",
      "source_start_line": 9,
      "source_end_line": 9,
      "source_anchor": "If $E \\subset B, f^{-1}(E)$ denotes the set of all $x \\in A$ such that $f(x) \\in E$ . We call $f^{-1}(E)$ the inverse image of $E$ under $f$ . If $y \\in B, f^{-1}(y)$ is the set of all $x \\in A$ such ",
      "atomic_requirements": [],
      "weight": 1,
      "review": "required"
    },
    {
      "block_id": "K-011",
      "decision": null,
      "kind": "formula",
      "source_start_line": 11,
      "source_end_line": 11,
      "source_anchor": "(The notation $x_{1} \\neq x_{2}$ means that $x_{1}$ and $x_{2}$ are distinct elements; otherwise we write $x_{1} = x_{2}$ .)",
      "atomic_requirements": [],
      "weight": 1,
      "review": "required"
    },
    {
      "block_id": "K-013",
      "decision": null,
      "kind": "definition",
      "source_start_line": 13,
      "source_end_line": 13,
      "source_anchor": "2.3 Definition If there exists a 1-1 mapping of A onto B, we say that A and B can be put in 1-1 correspondence, or that A and B have the same cardinal number, or, briefly, that A and B are equivalent,",
      "atomic_requirements": [],
      "weight": 1,
      "review": "required"
    },
    {
      "block_id": "K-015",
      "decision": null,
      "kind": "other",
      "source_start_line": 15,
      "source_end_line": 15,
      "source_anchor": "It is reflexive: $A \\sim A$ .",
      "atomic_requirements": [],
      "weight": 1,
      "review": "required"
    },
    {
      "block_id": "K-017",
      "decision": null,
      "kind": "other",
      "source_start_line": 17,
      "source_end_line": 17,
      "source_anchor": "It is symmetric: If $A \\sim B$ , then $B \\sim A$ .",
      "atomic_requirements": [],
      "weight": 1,
      "review": "required"
    },
    {
      "block_id": "K-019",
      "decision": null,
      "kind": "other",
      "source_start_line": 19,
      "source_end_line": 19,
      "source_anchor": "It is transitive: If $A \\sim B$ and $B \\sim C$ , then $A \\sim C$ .",
      "atomic_requirements": [],
      "weight": 1,
      "review": "required"
    },
    {
      "block_id": "K-021",
      "decision": null,
      "kind": "other",
      "source_start_line": 21,
      "source_end_line": 21,
      "source_anchor": "Any relation with these three properties is called an equivalence relation.",
      "atomic_requirements": [],
      "weight": 1,
      "review": "required"
    },
    {
      "block_id": "K-023",
      "decision": null,
      "kind": "definition",
      "source_start_line": 23,
      "source_end_line": 23,
      "source_anchor": "2.4 Definition For any positive integer n, let $J_{n}$ be the set whose elements are the integers 1, 2, ..., n; let J be the set consisting of all positive integers. For any set A, we say:",
      "atomic_requirements": [],
      "weight": 1,
      "review": "required"
    },
    {
      "block_id": "K-025",
      "decision": null,
      "kind": "other",
      "source_start_line": 25,
      "source_end_line": 25,
      "source_anchor": "(a) $A$ is finite if $A \\sim J_{n}$ for some $n$ (the empty set is also considered to be finite).",
      "atomic_requirements": [],
      "weight": 1,
      "review": "required"
    },
    {
      "block_id": "K-027",
      "decision": null,
      "kind": "other",
      "source_start_line": 27,
      "source_end_line": 27,
      "source_anchor": "(b) $A$ is infinite if $A$ is not finite.",
      "atomic_requirements": [],
      "weight": 1,
      "review": "required"
    },
    {
      "block_id": "K-029",
      "decision": null,
      "kind": "other",
      "source_start_line": 29,
      "source_end_line": 29,
      "source_anchor": "(c) $A$ is countable if $A \\sim J$ .",
      "atomic_requirements": [],
      "weight": 1,
      "review": "required"
    },
    {
      "block_id": "K-031",
      "decision": null,
      "kind": "other",
      "source_start_line": 31,
      "source_end_line": 31,
      "source_anchor": "(d) $A$ is uncountable if $A$ is neither finite nor countable.",
      "atomic_requirements": [],
      "weight": 1,
      "review": "required"
    },
    {
      "block_id": "K-033",
      "decision": null,
      "kind": "other",
      "source_start_line": 33,
      "source_end_line": 33,
      "source_anchor": "(e) $A$ is at most countable if $A$ is finite or countable.",
      "atomic_requirements": [],
      "weight": 1,
      "review": "required"
    },
    {
      "block_id": "K-035",
      "decision": null,
      "kind": "other",
      "source_start_line": 35,
      "source_end_line": 35,
      "source_anchor": "Countable sets are sometimes called enumerable, or denumerable.",
      "atomic_requirements": [],
      "weight": 1,
      "review": "required"
    },
    {
      "block_id": "K-037",
      "decision": null,
      "kind": "other",
      "source_start_line": 37,
      "source_end_line": 37,
      "source_anchor": "For two finite sets A and B, we evidently have $A \\sim B$ if and only if A and B contain the same number of elements. For infinite sets, however, the idea of “having the same number of elements” becom",
      "atomic_requirements": [],
      "weight": 1,
      "review": "required"
    },
    {
      "block_id": "K-039",
      "decision": null,
      "kind": "example",
      "source_start_line": 39,
      "source_end_line": 39,
      "source_anchor": "2.5 Example Let A be the set of all integers. Then A is countable. For, consider the following arrangement of the sets A and J:",
      "atomic_requirements": [],
      "weight": 1,
      "review": "required"
    },
    {
      "block_id": "K-041",
      "decision": null,
      "kind": "other",
      "source_start_line": 41,
      "source_end_line": 43,
      "source_anchor": "$$ A: \\quad 0, 1, - 1, 2, - 2, 3, - 3, \\dots $$",
      "atomic_requirements": [],
      "weight": 1,
      "review": "required"
    },
    {
      "block_id": "K-045",
      "decision": null,
      "kind": "other",
      "source_start_line": 45,
      "source_end_line": 47,
      "source_anchor": "$$ J \\colon \\qquad 1, 2, 3, 4, 5, 6, 7, \\ldots $$",
      "atomic_requirements": [],
      "weight": 1,
      "review": "required"
    },
    {
      "block_id": "K-049",
      "decision": null,
      "kind": "example",
      "source_start_line": 49,
      "source_end_line": 49,
      "source_anchor": "We can, in this example, even give an explicit formula for a function $f$ from $J$ to $A$ which sets up a 1-1 correspondence:",
      "atomic_requirements": [],
      "weight": 1,
      "review": "required"
    },
    {
      "block_id": "K-051",
      "decision": null,
      "kind": "formula",
      "source_start_line": 51,
      "source_end_line": 53,
      "source_anchor": "$$ f (n) = \\left\\{ \\begin{array}{l l} \\frac {n}{2} & (n \\text {   even }), \\\\ - \\frac {n - 1}{2} & (n \\text {   odd }). \\end{array} \\right. $$",
      "atomic_requirements": [],
      "weight": 1,
      "review": "required"
    },
    {
      "block_id": "K-055",
      "decision": null,
      "kind": "example",
      "source_start_line": 55,
      "source_end_line": 55,
      "source_anchor": "2.6 Remark A finite set cannot be equivalent to one of its proper subsets. That this is, however, possible for infinite sets, is shown by Example 2.5, in which J is a proper subset of A.",
      "atomic_requirements": [],
      "weight": 1,
      "review": "required"
    },
    {
      "block_id": "K-057",
      "decision": null,
      "kind": "definition",
      "source_start_line": 57,
      "source_end_line": 57,
      "source_anchor": "In fact, we could replace Definition 2.4(b) by the statement: A is infinite if A is equivalent to one of its proper subsets.",
      "atomic_requirements": [],
      "weight": 1,
      "review": "required"
    },
    {
      "block_id": "K-059",
      "decision": null,
      "kind": "definition",
      "source_start_line": 59,
      "source_end_line": 59,